{
  "bridge_version": "mt5.paper.v1",
  "ticket_id": "mt5-paper-20260328-smoke-001",
  "created_at": "2026-03-28T11:43:00+01:00",
  "mode": "paper",
  "symbol": "EURUSD",
  "side": "buy",
  "order_plan": "stop_entry",
  "entries": [
    {
      "client_entry_id": "smoke-entry-1",
      "entry_type": "stop",
      "price": 1.2000,
      "volume_lots": 0.01,
      "comment": "paper bridge weekend smoke test"
    }
  ],
  "stop_loss": {
    "price": 1.1900
  },
  "take_profit": {
    "price": 1.2200
  },
  "trailing": {
    "enabled": false,
    "activation_price": null,
    "distance_price": null,
    "step_price": null
  },
  "max_risk_usdt": 30,
  "strategy_context": {
    "source": "Gray MT5 bridge smoke test",
    "timeframe": "4H",
    "placeable_now": true
  },
  "note": "Paper-only MT5 bridge smoke test. Minimal single-order pending ticket."
}
