{
  "bridge_version": "mt5.paper.v1",
  "ticket_id": "mt5-paper-20260329-nzdsgd-autotrade-l2-001",
  "created_at": "2026-03-29T21:56:00Z",
  "mode": "paper",
  "symbol": "NZDSGD",
  "side": "sell",
  "order_plan": "limit_ladder",
  "entries": [
    {
      "client_entry_id": "nzdsgd-sell-limit-2",
      "entry_type": "limit",
      "price": 0.7442,
      "volume_lots": 0.06,
      "comment": "NZDSGD ladder leg 2"
    }
  ],
  "stop_loss": {
    "price": 0.7514
  },
  "take_profit": {
    "price": 0.7315
  },
  "max_risk_usdt": 35,
  "strategy_context": {
    "source": "Deep analysis autotrade plan for screener winner NZDSGD",
    "timeframe": "4H / 1D",
    "setup_bias": "bearish continuation / sell rally",
    "leg": "L2",
    "planned_tp1": 0.7369,
    "planned_tp2": 0.7315,
    "planned_rr_tp1": 1.01,
    "planned_rr_tp2": 1.76,
    "assumed_nzdusd": 0.5753
  },
  "note": "NZDSGD paper autotrade L2. Sell limit at midpoint of rally-short zone."
}
