{
  "bridge_version": "mt5.paper.v1",
  "ticket_id": "mt5-paper-MT5_FRX-4 hours-2026-04-03T130612-927Z-nzdusd-20260403-132110-phase1-001",
  "created_at": "2026-04-03T13:21:10Z",
  "mode": "paper",
  "symbol": "NZDUSD.pro",
  "side": "sell",
  "order_plan": "limit_ladder",
  "entries": [
    {
      "client_entry_id": "nzdusd-phase1-ladder-1",
      "entry_type": "limit",
      "price": 0.58398,
      "volume_lots": 0.06,
      "comment": "NZDUSD -> NZDUSD.pro phase1 ladder limit entry 1"
    },
    {
      "client_entry_id": "nzdusd-phase1-ladder-2",
      "entry_type": "limit",
      "price": 0.57777,
      "volume_lots": 0.06,
      "comment": "NZDUSD -> NZDUSD.pro phase1 ladder limit entry 2"
    },
    {
      "client_entry_id": "nzdusd-phase1-ladder-3",
      "entry_type": "limit",
      "price": 0.57265,
      "volume_lots": 0.05,
      "comment": "NZDUSD -> NZDUSD.pro phase1 ladder limit entry 3"
    }
  ],
  "stop_loss": {
    "price": 0.57856
  },
  "take_profit": {
    "price": 0.57736
  },
  "max_risk_usdt": 100.0,
  "strategy_context": {
    "source": "Phase1 MT5 FX autotrade deep analysis for NZDUSD",
    "watchlist": "MT5_FRX",
    "timeframe": "4 hours",
    "tv_root_symbol": "NZDUSD",
    "mt5_execution_symbol": "NZDUSD.pro",
    "is_proxy_symbol": false,
    "proxy_source": null,
    "orderability_decision": "placeable_conditional_only",
    "execution_template": "ladder_limit_3",
    "setup": "SHORT_CONTINUATION",
    "planned_tp1": 0.5777,
    "planned_tp2": 0.57736,
    "planned_rr_tp1": 1.0,
    "planned_rr_tp2": 1.79,
    "planned_total_notional_usd": 9828.21,
    "modeled_margin_usd": 982.82,
    "bridge_tp_note": "Bridge v1 supports one live TP for the package; TP2 is used as executable TP while TP1 remains a management level."
  },
  "note": "NZDUSD phase1 autotrade via NZDUSD.pro. Default risk budget 100 USD. Execution template: ladder_limit_3."
}
