{
  "bridge_version": "mt5.paper.v1",
  "ticket_id": "mt5-paper-20260328-btc-ladder-002",
  "created_at": "2026-03-28T12:50:00+01:00",
  "mode": "paper",
  "symbol": "BTCUSD",
  "side": "buy",
  "order_plan": "limit_ladder",
  "entries": [
    {
      "client_entry_id": "btc-ladder-entry-2",
      "entry_type": "limit",
      "price": 65400.0,
      "volume_lots": 0.08,
      "comment": "paper bridge BTC ladder level 2"
    }
  ],
  "stop_loss": {
    "price": 65000.0
  },
  "take_profit": {
    "price": 67800.0
  },
  "trailing": {
    "enabled": false,
    "activation_price": null,
    "distance_price": null,
    "step_price": null
  },
  "max_risk_usdt": 100,
  "strategy_context": {
    "source": "Gray MT5 bridge BTC ladder test",
    "timeframe": "1H",
    "placeable_now": true
  },
  "note": "BTCUSD ladder level 2 of 2. Shared SL, TP2 on second tranche."
}
