{
  "bridge_version": "mt5.paper.v1",
  "ticket_id": "p1-solusdtp-0404061511",
  "created_at": "2026-04-04T06:15:11Z",
  "mode": "paper",
  "symbol": "SOLUSD",
  "side": "sell",
  "order_plan": "limit_ladder",
  "entries": [
    {
      "client_entry_id": "solusdt.p-phase1-ladder-1",
      "entry_type": "limit",
      "price": 92.84,
      "volume_lots": 96.0,
      "comment": "SOLUSDT.P -> SOLUSD phase1 ladder limit entry 1"
    },
    {
      "client_entry_id": "solusdt.p-phase1-ladder-2",
      "entry_type": "limit",
      "price": 92.44,
      "volume_lots": 96.0,
      "comment": "SOLUSDT.P -> SOLUSD phase1 ladder limit entry 2"
    }
  ],
  "stop_loss": {
    "price": 93.16
  },
  "take_profit": {
    "price": 91.7
  },
  "max_risk_usdt": 100.0,
  "strategy_context": {
    "source": "Phase1 MT5 FX autotrade deep analysis for SOLUSDT.P",
    "watchlist": "TRADFI",
    "timeframe": "4 hours",
    "tv_root_symbol": "SOLUSDT.P",
    "mt5_execution_symbol": "SOLUSD",
    "is_proxy_symbol": false,
    "proxy_source": null,
    "orderability_decision": "placeable_conditional_only",
    "execution_template": "ladder_limit_2",
    "setup": "SHORT_CONTINUATION",
    "planned_tp1": 92.12,
    "planned_tp2": 91.7,
    "planned_rr_tp1": 1.0,
    "planned_rr_tp2": 1.81,
    "planned_total_notional_usd": 17786.88,
    "modeled_margin_usd": 988.16,
    "bridge_tp_note": "Bridge v1 supports one live TP for the package; TP2 is used as executable TP while TP1 remains a management level."
  },
  "note": "SOLUSDT.P phase1 autotrade via SOLUSD. Default risk budget 100 USD. Execution template: ladder_limit_2."
}
