{
  "bridge_version": "mt5.paper.v1",
  "ticket_id": "p1-audcad-0409050728",
  "created_at": "2026-04-09T05:07:28Z",
  "mode": "paper",
  "symbol": "AUDCAD.pro",
  "side": "buy",
  "order_plan": "limit_ladder",
  "entries": [
    {
      "client_entry_id": "audcad-phase1-ladder-1",
      "entry_type": "limit",
      "price": 0.95903,
      "volume_lots": 0.16,
      "comment": "AUDCAD -> AUDCAD.pro phase1 ladder limit entry 1"
    },
    {
      "client_entry_id": "audcad-phase1-ladder-2",
      "entry_type": "limit",
      "price": 0.96275,
      "volume_lots": 0.16,
      "comment": "AUDCAD -> AUDCAD.pro phase1 ladder limit entry 2"
    }
  ],
  "stop_loss": {
    "price": 0.95802
  },
  "take_profit": {
    "price": 0.96606
  },
  "max_risk_usdt": 100.0,
  "strategy_context": {
    "source": "Phase1 MT5 FX autotrade deep analysis for AUDCAD",
    "watchlist": "MT5_FRX",
    "timeframe": "4 hours",
    "tv_root_symbol": "AUDCAD",
    "mt5_execution_symbol": "AUDCAD.pro",
    "is_proxy_symbol": false,
    "proxy_source": null,
    "orderability_decision": "placeable_conditional_only",
    "execution_template": "hybrid_ladder_breakout",
    "setup": "LONG_CONTINUATION",
    "planned_tp1": 0.96376,
    "planned_tp2": 0.96606,
    "planned_rr_tp1": 1.0,
    "planned_rr_tp2": 1.8,
    "planned_total_notional_usd": 33305.21,
    "modeled_margin_usd": 1110.17,
    "bridge_tp_note": "Bridge v1 supports one live TP for the package; TP2 is used as executable TP while TP1 remains a management level."
  },
  "note": "AUDCAD phase1 autotrade via AUDCAD.pro. Default risk budget 100 USD. Execution template: hybrid_ladder_breakout."
}
