{
  "bridge_version": "mt5.paper.v1",
  "ticket_id": "mt5-paper-20260326-001",
  "created_at": "2026-03-26T12:45:00+01:00",
  "mode": "paper",
  "symbol": "EURUSD",
  "side": "buy",
  "order_plan": "limit_ladder",
  "entries": [
    {
      "client_entry_id": "entry-1",
      "entry_type": "limit",
      "price": 1.0825,
      "volume_lots": 0.1,
      "comment": "paper bridge v1 single-entry smoke test"
    }
  ],
  "stop_loss": {
    "price": 1.0795
  },
  "take_profit": {
    "price": 1.0885
  },
  "trailing": {
    "enabled": false,
    "activation_price": null,
    "distance_price": null,
    "step_price": null
  },
  "max_risk_usdt": 30,
  "strategy_context": {
    "source": "Gray discretionary ticket",
    "timeframe": "4H",
    "placeable_now": true
  },
  "note": "Paper-only bridge scaffold example. Do not use on live accounts."
}
