{
  "bridge_version": "mt5.paper.v1",
  "ticket_id": "mt5-paper-btc-trailing-percent-example",
  "created_at": "2026-03-28T13:15:00+01:00",
  "mode": "paper",
  "symbol": "BTCUSD",
  "side": "buy",
  "order_plan": "stop_entry",
  "entries": [
    {
      "client_entry_id": "btc-trailing-example-1",
      "entry_type": "stop",
      "price": 67000.0,
      "volume_lots": 0.01,
      "comment": "example ticket with percent trailing"
    }
  ],
  "stop_loss": {
    "price": 66000.0
  },
  "take_profit": {
    "price": 69000.0
  },
  "trailing": {
    "enabled": true,
    "trigger_price": 67500.0,
    "distance_mode": "percent",
    "distance_value": 0.8,
    "step_price": 50.0
  },
  "max_risk_usdt": 30,
  "strategy_context": {
    "source": "Gray trailing example",
    "timeframe": "1H",
    "placeable_now": true
  },
  "note": "Example: activate trailing after BTCUSD reaches 67500, then trail by 0.8% with a 50 USD minimum SL improvement step."
}
