{
  "bridge_version": "mt5.paper.v1",
  "ticket_id": "mt5-paper-20260328-btc-smoke-001",
  "created_at": "2026-03-28T12:29:00+01:00",
  "mode": "paper",
  "symbol": "BTCUSD",
  "side": "buy",
  "order_plan": "stop_entry",
  "entries": [
    {
      "client_entry_id": "btc-smoke-entry-1",
      "entry_type": "stop",
      "price": 250000.0,
      "volume_lots": 0.01,
      "comment": "paper bridge BTC smoke test"
    }
  ],
  "stop_loss": {
    "price": 200000.0
  },
  "take_profit": {
    "price": 300000.0
  },
  "trailing": {
    "enabled": false,
    "activation_price": null,
    "distance_price": null,
    "step_price": null
  },
  "max_risk_usdt": 30,
  "strategy_context": {
    "source": "Gray MT5 bridge BTC smoke test",
    "timeframe": "1H",
    "placeable_now": true
  },
  "note": "Paper-only BTCUSD bridge smoke test. Far-away pending order to verify broker acceptance on an open market."
}
