{
  "bridge_version": "mt5.paper.v1",
  "ticket_id": "mt5-paper-20260328-btc-tight-001",
  "created_at": "2026-03-28T12:32:00+01:00",
  "mode": "paper",
  "symbol": "BTCUSD",
  "side": "buy",
  "order_plan": "stop_entry",
  "entries": [
    {
      "client_entry_id": "btc-tight-entry-1",
      "entry_type": "stop",
      "price": 66400.0,
      "volume_lots": 0.01,
      "comment": "paper bridge BTC near-market tight TP/SL test"
    }
  ],
  "stop_loss": {
    "price": 66300.0
  },
  "take_profit": {
    "price": 66500.0
  },
  "trailing": {
    "enabled": false,
    "activation_price": null,
    "distance_price": null,
    "step_price": null
  },
  "max_risk_usdt": 30,
  "strategy_context": {
    "source": "Gray MT5 bridge BTC tight test",
    "timeframe": "1H",
    "placeable_now": true
  },
  "note": "Paper-only BTCUSD near-market test with tight SL/TP to verify post-fill lifecycle."
}
